{"run":32,"commit":"2fe1cc3","metric":172.68,"metrics":{"encode_ms":94.24,"decode_ms":78.44,"lua52_total_ms":1144.62,"lua53_total_ms":1110.14,"lua54_total_ms":941.13},"status":"discard","description":"Move number check before string check in encode_value — massive regression","timestamp":1776218400000,"segment":0,"confidence":null,"asi":{"hypothesis":"Move number check before string check in encode_value for faster dispatch","result":"Metric 172.68 vs 127.23 baseline. Massive regression.","key_insight":"LuaJIT might have optimized the previous order better, or the frequency of types in the benchmark favors the original order more than expected. Also, changing hot function structure can trigger deoptimizations."}}
{"run":33,"commit":"5d74545","metric":165.39,"metrics":{"encode_ms":89.81,"decode_ms":75.58,"lua52_total_ms":1157.11,"lua53_total_ms":1054.47,"lua54_total_ms":914.15},"status":"keep","description":"Optimize parse_array and parse_object loop: avoid redundant skip_whitespace calls. -5% total_ms, -7% decode_ms across all Lua versions.","timestamp":1776219600000,"segment":0,"confidence":null,"asi":{"hypothesis":"Avoid redundant skip_whitespace calls in array/object loops","result":"Consistent improvement across all Lua versions. LuaJIT decode -7%.","key_insight":"The loop was calling skip_whitespace twice per element (once at the top and once at the comma check). Inlining the logic and reusing results is a clear win."}}
