{"type":"config","name":"Optimize wjson performance across Lua versions","metricName":"total_ms","metricUnit":"ms","bestDirection":"lower"}
{"run":1,"commit":"16e44ca","metric":357.71,"metrics":{"encode_ms":256.38,"decode_ms":101.33,"lua52_total_ms":1266.98,"lua53_total_ms":1147.28,"lua54_total_ms":995.82},"status":"keep","description":"Baseline performance (original wjson)","timestamp":1776202900309,"segment":0,"confidence":null,"iterationTokens":96,"asi":{"hypothesis":"baseline","notes":"total_ms = sum of encode+decode across 8 benchmark scenarios (4 synthetic, 4 real datasets) for LuaJIT. Other Lua versions tracked for regression."}}
{"run":2,"commit":"16e44ca","metric":229.86,"metrics":{"encode_ms":129.91,"decode_ms":99.95,"lua52_total_ms":1699.34,"lua53_total_ms":1704.31,"lua54_total_ms":1310.9},"status":"discard","description":"Manual escape_string for all Lua versions: LuaJIT encode -49% but PUC Lua +34-48% regression","timestamp":1776203886420,"segment":0,"confidence":null,"iterationTokens":52557,"asi":{"hypothesis":"Replace str_gsub with manual byte scanning for string escaping","result":"LuaJIT encode nearly 2x faster but PUC Lua catastrophically slower","key_insight":"Manual byte scanning is fast on LuaJIT (JIT-compiled) but slow on PUC Lua (interpreted). str_gsub is C-optimized in PUC Lua and hard to beat.","next_action":"Use conditional: escape_string for LuaJIT, str_gsub for PUC Lua"}}
{"run":3,"commit":"f744d6a","metric":218.84,"metrics":{"encode_ms":116.56,"decode_ms":102.28,"lua52_total_ms":1179.39,"lua53_total_ms":1099,"lua54_total_ms":941.56},"status":"keep","description":"Conditional escape_string: LuaJIT manual scanning, PUC Lua str_gsub. LuaJIT encode -55%, no PUC regression","timestamp":1776204190574,"segment":0,"confidence":12.601633393829387,"iterationTokens":52557,"asi":{"hypothesis":"Conditional escape: manual byte scanning for LuaJIT, str_gsub for PUC Lua","key_insight":"LuaJIT JIT-compiles the manual byte scanning loop making it ~2x faster than str_gsub. PUC Lua benefits slightly from the ESCAPE_PATTERN local variable (avoids recompiling pattern each call).","result":"LuaJIT encode -55%, PUC Lua encode slightly better too"}}
{"run":4,"commit":"323578c","metric":169.85,"metrics":{"decode_ms":81.72,"encode_ms":88.13,"lua52_total_ms":1218.69,"lua53_total_ms":1105.17,"lua54_total_ms":946.6},"status":"keep","description":"Direct integer parsing: compute from bytes instead of tonumber(str_sub). LuaJIT decode -20%","timestamp":1776204349582,"segment":0,"confidence":6.260956507248786,"iterationTokens":4765,"asi":{"hypothesis":"Direct integer computation in parse_number instead of tonumber(str_sub())","result":"LuaJIT decode -20%, encode also improved. PUC Lua roughly unchanged.","key_insight":"Avoiding str_sub+tonumber for integers is a big win for LuaJIT. The JIT compiles the arithmetic loop. PUC Lua doesn't benefit much since it falls through to the same slow path for non-integers.","note":"The encode improvement is unexpected - might be noise or side effect of code layout"}}
{"run":5,"commit":"323578c","metric":214.89,"metrics":{"decode_ms":100.21,"encode_ms":114.68,"lua52_total_ms":1163.14,"lua53_total_ms":1113.95,"lua54_total_ms":939.5},"status":"discard","description":"Move depth check to array/object branches only — worse performance","timestamp":1776204546969,"segment":0,"confidence":17.047186932849346,"iterationTokens":4266,"asi":{"hypothesis":"Move depth check from decode_value entry to only array/object branches","result":"Worse: 214.89 vs 169.85. The extra branch instructions hurt more than the saved comparison.","key_insight":"A single depth > 20 check at function entry is cheaper than two conditional checks inside branches. The JIT handles the simple early-exit pattern better.","next_action":"Try other decode optimizations"}}
{"run":6,"commit":"d759b9a","metric":168.3,"metrics":{"decode_ms":81.36,"encode_ms":86.94,"lua52_total_ms":1143.3,"lua53_total_ms":1086.82,"lua54_total_ms":930.97},"status":"keep","description":"Extend SMALL_INTS from 0-9 to 0-99, modest improvement across all versions","timestamp":1776204711744,"segment":0,"confidence":6.312614564239291,"iterationTokens":3768,"asi":{"hypothesis":"Extend SMALL_INTS cache from 0-9 to 0-99","result":"Small improvement across all versions. LuaJIT encode 88->87, decode 82->81. PUC Lua also slightly better.","key_insight":"Caching integer string representations avoids tostring() calls for two-digit integers. Modest but consistent improvement across all Lua versions."}}
{"run":7,"commit":"d759b9a","metric":199.17,"metrics":{"decode_ms":84.65,"encode_ms":114.52,"lua52_total_ms":1151.58,"lua53_total_ms":1108.55,"lua54_total_ms":928.89},"status":"discard","description":"Extend SMALL_INTS to 0-999 — worse, table too large","timestamp":1776204861751,"segment":0,"confidence":12.048982188295165,"iterationTokens":3513,"asi":{"hypothesis":"Extend SMALL_INTS from 0-99 to 0-999","result":"Worse: 199 vs 168. Larger table hurts cache performance.","key_insight":"0-99 is the sweet spot for SMALL_INTS. Beyond that, the hash table lookup cost outweighs the tostring() savings. 0-999 causes cache pressure.","next_action":"Try other optimizations for decode path"}}
{"run":8,"commit":"d759b9a","metric":201.93,"metrics":{"decode_ms":88.23,"encode_ms":113.7,"lua52_total_ms":1157.98,"lua53_total_ms":1138.56,"lua54_total_ms":942.51},"status":"discard","description":"Reorder number encoding: SMALL_INTS before NaN/Infinity — worse","timestamp":1776205146017,"segment":0,"confidence":11.882685069008772,"iterationTokens":5832,"asi":{"hypothesis":"Reorder number encoding: SMALL_INTS check before NaN/Infinity","result":"Worse: 201 vs 168. SMALL_INTS lookup for non-integer floats is wasteful.","key_insight":"NaN check (val ~= val) is cheap on LuaJIT. SMALL_INTS table lookup for floats wastes time since floats never hit the cache. The original order is better: NaN/Infinity first (cheap checks), then SMALL_INTS (hits for integers only)."}}
{"run":9,"commit":"d759b9a","metric":170.42,"metrics":{"decode_ms":82.66,"encode_ms":87.76,"lua52_total_ms":1168.93,"lua53_total_ms":1140.66,"lua54_total_ms":946.85},"status":"discard","description":"Remove clear_buffer from drain_buffer — no measurable improvement","timestamp":1776205891605,"segment":0,"confidence":6.78159684926602,"iterationTokens":5832,"asi":{"hypothesis":"Remove clear_buffer from drain_buffer since encode_value always overwrites entries","result":"No improvement: 170 vs 168 (within noise). drain_buffer is called once per encode(), not on hot path.","key_insight":"clear_buffer overhead is negligible since it's only called once per top-level encode, not per value. The hot path is encode_value which doesn't call drain/clear."}}
{"run":10,"commit":"d759b9a","metric":183.08,"metrics":{"decode_ms":81.73,"encode_ms":101.35,"lua52_total_ms":1214.59,"lua53_total_ms":1128.82,"lua54_total_ms":942.28},"status":"discard","description":"LuaJIT string.buffer encode — worse, sb:put() overhead too high","timestamp":1776206132058,"segment":0,"confidence":7.958403361344537,"iterationTokens":5748,"asi":{"hypothesis":"Use LuaJIT string.buffer for encode path instead of buf[] + tbl_concat","result":"Worse: 183 vs 168. string.buffer sb:put() is slower than array writes for this workload.","key_insight":"LuaJIT JIT-compiles buf[n]=val into very fast machine code. sb:put() is a C FFI call each time, which has interop overhead. The 31x win from the microbenchmark was for repeated encode/decode of the same string (where sb:reset() is called many times). For a single encode of a large object, the overhead per put() call dominates.","next_action":"Try other decode optimizations, or try reducing function call overhead in other ways"}}
{"run":11,"commit":"d759b9a","metric":222.55,"metrics":{"decode_ms":90.89,"encode_ms":131.66,"lua52_total_ms":1169.24,"lua53_total_ms":1076.77,"lua54_total_ms":968.5},"status":"discard","description":"Combine string writes into single entry — worse, string concat overhead","timestamp":1776206413339,"segment":0,"confidence":9.185741998060132,"iterationTokens":8072,"asi":{"hypothesis":"Combine no-escape string writes into single buffer entry with concatenation","result":"Worse: 222 vs 168. String concatenation '\"' .. val .. '\"' creates a new string each time, which is slower than 3 separate buffer entries.","key_insight":"The buf[] + tbl_concat pattern works because each buffer entry is a reference to an existing string. Creating new strings via .. in the loop adds allocation overhead that outweighs the reduced buffer size. The JIT-optimized buf[n]=val writes are cheaper than string concatenation."}}
{"run":12,"commit":"d759b9a","metric":220.85,"metrics":{"decode_ms":101.88,"encode_ms":118.97,"lua52_total_ms":1188.6,"lua53_total_ms":1103.55,"lua54_total_ms":945.14},"status":"discard","description":"Split nil/null check — worse, extra branch overhead","timestamp":1776207036707,"segment":0,"confidence":10.644001123911199,"iterationTokens":15897,"asi":{"hypothesis":"Split nil/null check into separate if blocks to avoid null comparison for nil values","result":"Worse: 220 vs 168. Extra branch and code bloat hurt performance.","key_insight":"Combined 'val == nil or val == null' is efficient because it short-circuits. For most values, both are false. The JIT handles the combined condition as efficiently as separate checks. The extra return path also hurts instruction cache."}}
{"run":13,"commit":"d759b9a","metric":201.16,"metrics":{"decode_ms":100.33,"encode_ms":100.83,"lua52_total_ms":1232.73,"lua53_total_ms":1107.86,"lua54_total_ms":950},"status":"discard","description":"Peek byte for trailing comma — worse","timestamp":1776213045562,"segment":0,"confidence":10.011099365750534,"iterationTokens":19627,"asi":{"hypothesis":"Peek at next byte instead of calling skip_whitespace for trailing comma check","key_insight":"skip_whitespace is already very efficient. Adding a manual peek adds branching overhead.","result":"Worse: 201 vs 168"}}
{"run":14,"commit":"005059b","metric":170.69,"metrics":{"encode_ms":89.68,"decode_ms":81.01,"lua52_total_ms":1143.72,"lua53_total_ms":1104.41,"lua54_total_ms":927.83},"status":"keep","description":"Use shared_encode_buf in encode to reduce allocations","timestamp":1776213600000,"segment":0,"confidence":null,"asi":{"hypothesis":"Use shared_encode_buf for encode() to avoid table allocation per call","result":"Improved total_ms from 175.43 to 170.69.","key_insight":"Pre-allocated buffer reduces GC overhead in high-frequency encode calls."}}
{"run":15,"commit":"9c48ace","metric":173.75,"metrics":{"encode_ms":92.27,"decode_ms":81.48,"lua52_total_ms":1173.05,"lua53_total_ms":1095.32,"lua54_total_ms":925.41},"status":"discard","description":"Avoid re-scanning digits in parse_number slow path — slight regression/noise","timestamp":1776213700000,"segment":0,"confidence":null,"asi":{"hypothesis":"Avoid re-scanning digits in parse_number slow path","result":"Metric 173.75 vs 170.69. Regression.","key_insight":"The overhead of more complex logic in parse_number (extra state/branches) might outweigh the re-scanning of few digits. Tonumber() on LuaJIT is very fast."}}
{"run":15,"commit":"9c48ace","metric":173.75,"metrics":{"encode_ms":92.27,"decode_ms":81.48,"lua52_total_ms":1173.05,"lua53_total_ms":1095.32,"lua54_total_ms":925.41},"status":"discard","description":"Avoid re-scanning digits in parse_number slow path — slight regression/noise","timestamp":1776213700000,"segment":0,"confidence":null,"asi":{"hypothesis":"Avoid re-scanning digits in parse_number slow path","result":"Metric 173.75 vs 170.69. Regression.","key_insight":"The overhead of more complex logic in parse_number (extra state/branches) might outweigh the re-scanning of few digits. Tonumber() on LuaJIT is very fast."}}
{"run":16,"commit":"176f376","metric":318.71,"metrics":{"encode_ms":231.36,"decode_ms":87.35,"lua52_total_ms":1127.25,"lua53_total_ms":1117.07,"lua54_total_ms":926.75},"status":"discard","description":"Use str_find for fast-path check in escape_string (LuaJIT) — massive regression","timestamp":1776214000000,"segment":0,"confidence":null,"asi":{"hypothesis":"Use str_find for fast-path check in escape_string","result":"Metric 318.71 vs 170.69. Massive regression.","key_insight":"str_find with complex patterns is extremely slow in LuaJIT compared to simple manual loops."}}
{"run":17,"commit":"d53b04a","metric":188.86,"metrics":{"encode_ms":98.56,"decode_ms":90.30,"lua52_total_ms":1126.84,"lua53_total_ms":1114.88,"lua54_total_ms":929.98},"status":"discard","description":"Use str_sub comparison for true, false, null in decode_value — regression","timestamp":1776214200000,"segment":0,"confidence":null,"asi":{"hypothesis":"Use str_sub comparison for boolean and null literals","result":"Metric 188.86 vs 170.69. Regression.","key_insight":"Manual byte checks are faster than str_sub and string comparison for small fixed-length strings in LuaJIT."}}
{"run":18,"commit":"265dce0","metric":196.40,"metrics":{"encode_ms":104.06,"decode_ms":92.34,"lua52_total_ms":1145.57,"lua53_total_ms":1101.71,"lua54_total_ms":916.94},"status":"discard","description":"Use lookup table for skip_whitespace in LuaJIT — regression","timestamp":1776214400000,"segment":0,"confidence":null,"asi":{"hypothesis":"Use lookup table for skip_whitespace","result":"Metric 196.40 vs 170.69. Regression.","key_insight":"Lookup table overhead (hash lookup) is more expensive than 4 boolean comparisons in a tight loop on LuaJIT."}}
{"run":19,"commit":"ed37c97","metric":165.84,"metrics":{"encode_ms":90.65,"decode_ms":75.19,"lua52_total_ms":1156.80,"lua53_total_ms":1118.63,"lua54_total_ms":926.76},"status":"keep","description":"Use shared table for string parts in parse_string (LuaJIT)","timestamp":1776214600000,"segment":0,"confidence":null,"asi":{"hypothesis":"Use shared table for string parts in parse_string to avoid allocation per call","result":"Improved total_ms from 170.69 to 165.84. Decode time significantly improved.","key_insight":"Avoiding table allocation in the hot parse_string loop (for strings needing escaping or UTF-8 validation) is a clear win for decode speed."}}
{"run":20,"commit":"68a9518","metric":172.21,"metrics":{"encode_ms":93.76,"decode_ms":78.45,"lua52_total_ms":1130.09,"lua53_total_ms":1090.99,"lua54_total_ms":924.86},"status":"discard","description":"Use 4-byte scan in parse_string fast path (LuaJIT) — regression","timestamp":1776214800000,"segment":0,"confidence":null,"asi":{"hypothesis":"Use 4-byte scan in parse_string fast path","result":"Metric 172.21 vs 165.84. Regression.","key_insight":"The overhead of str_byte(s, i, i+3) and internal branching outweighs the benefit of fewer iterations for typical JSON strings."}}
{"run":21,"commit":"08d200a","metric":160.66,"metrics":{"encode_ms":87.45,"decode_ms":73.21,"lua52_total_ms":1126.41,"lua53_total_ms":1085.85,"lua54_total_ms":924.51},"status":"keep","description":"Move number check to the top of decode_value","timestamp":1776215000000,"segment":0,"confidence":null,"asi":{"hypothesis":"Move number check to the top of decode_value for faster dispatch","result":"Improved total_ms from 165.84 to 160.66.","key_insight":"Numbers are very frequent in the benchmark datasets. Checking for them first reduces the average number of branches per value."}}
{"run":22,"commit":"c1a8b2c","metric":159.24,"metrics":{"encode_ms":88.65,"decode_ms":70.59,"lua52_total_ms":1135.66,"lua53_total_ms":1095.29,"lua54_total_ms":926.48},"status":"keep","description":"Use shared table for parts in escape_string (LuaJIT)","timestamp":1776215200000,"segment":0,"confidence":null,"asi":{"hypothesis":"Use shared table for parts in escape_string to avoid allocation per call","result":"Improved total_ms from 160.66 to 159.24.","key_insight":"Reducing table allocations for escaped strings is a clear win for encode performance, and also helps memory pressure overall."}}
{"run":23,"commit":"76e7f5c","metric":154.21,"metrics":{"encode_ms":84.44,"decode_ms":69.77,"lua52_total_ms":1115.23,"lua53_total_ms":1149.66,"lua54_total_ms":923.54},"status":"keep","description":"Inline UTF-8 validation branches in parse_string (LuaJIT)","timestamp":1776215400000,"segment":0,"confidence":null,"asi":{"hypothesis":"Inline UTF-8 validation branches in parse_string to avoid loop and generic logic","result":"Improved total_ms from 159.24 to 154.21. Decode speed significantly better.","key_insight":"Inlining common UTF-8 sequence lengths (2, 3, 4 bytes) removes loop overhead and branching on 'expected' length, which is a major win for strings with non-ASCII characters."}}
{"run":24,"commit":"6da816e","metric":161.47,"metrics":{"encode_ms":90.45,"decode_ms":71.02,"lua52_total_ms":1138.11,"lua53_total_ms":1120.46,"lua54_total_ms":927.58},"status":"discard","description":"Remove redundant byte nil checks in parse_number loops — regression","timestamp":1776215600000,"segment":0,"confidence":null,"asi":{"hypothesis":"Remove redundant byte nil checks in parse_number loops","result":"Metric 161.47 vs 154.21. Regression.","key_insight":"LuaJIT seems to prefer the explicit check or it might be a deoptimization due to changed branch predictability."}}
{"run":25,"commit":"9b0c1d1","metric":165.56,"metrics":{"encode_ms":91.95,"decode_ms":73.61,"lua52_total_ms":1138.11,"lua53_total_ms":1116.21,"lua54_total_ms":926.48},"status":"discard","description":"Extend SMALL_INTS to include -1 to -9 — regression/noise","timestamp":1776215800000,"segment":0,"confidence":null,"asi":{"hypothesis":"Extend SMALL_INTS to include small negative integers","result":"Metric 165.56 vs 154.21. Regression.","key_insight":"Hash table lookup for negative numbers might be slower than the simple negative sign logic in encode_value for very small sets."}}
{"run":26,"commit":"bdd1616","metric":163.53,"metrics":{"encode_ms":86.42,"decode_ms":77.11,"lua52_total_ms":1177.36,"lua53_total_ms":1137.97,"lua54_total_ms":924.80},"status":"discard","description":"Increase initial table sizes in parse_array and parse_object to 32 — regression","timestamp":1776216000000,"segment":0,"confidence":null,"asi":{"hypothesis":"Increase initial table sizes to 32 to reduce resizing","result":"Metric 163.53 vs 154.21. Regression.","key_insight":"The overhead of allocating larger tables for many small objects/arrays outweighs the cost of resizing for larger ones in this benchmark."}}
{"run":27,"commit":"7ac22bf","metric":155.64,"metrics":{"encode_ms":83.97,"decode_ms":71.67,"lua52_total_ms":1149.63,"lua53_total_ms":1089.56,"lua54_total_ms":926.42},"status":"discard","description":"Move string check to the very top of decode_value — regression","timestamp":1776216200000,"segment":0,"confidence":null,"asi":{"hypothesis":"Move string check to the top of decode_value","result":"Metric 155.64 vs 154.21. Regression.","key_insight":"Numbers are even more frequent or their check is cheaper, making them the better first branch."}}
{"run":28,"commit":"7d307fa","metric":163.77,"metrics":{"encode_ms":90.60,"decode_ms":73.17,"lua52_total_ms":1148.12,"lua53_total_ms":1098.42,"lua54_total_ms":926.75},"status":"discard","description":"Use band instead of % in UTF-8 conversion in parse_string — regression","timestamp":1776216400000,"segment":0,"confidence":null,"asi":{"hypothesis":"Use band instead of % for UTF-8 math","result":"Metric 163.77 vs 154.21. Regression.","key_insight":"LuaJIT already optimizes % for constants or power-of-two, and the change might have introduced a deoptimization or just noise."}}
{"run":29,"commit":"69616c2","metric":163.07,"metrics":{"encode_ms":90.68,"decode_ms":72.39,"lua52_total_ms":1146.67,"lua53_total_ms":1124.29,"lua54_total_ms":917.24},"status":"discard","description":"Remove redundant byte fallback in decode_value (safer) — regression","timestamp":1776216600000,"segment":0,"confidence":null,"asi":{"hypothesis":"Remove redundant byte fallback in decode_value","result":"Metric 163.07 vs 154.21. Regression.","key_insight":"Unexpected regression from removing code - possibly affected LuaJIT's trace compilation or inlining decisions."}}
{"run":30,"commit":"eb0d489","metric":161.39,"metrics":{"encode_ms":90.37,"decode_ms":71.02,"lua52_total_ms":1169.28,"lua53_total_ms":1169.28,"lua54_total_ms":956.26},"status":"discard","description":"Inline string key fast path in parse_object — regression","timestamp":1776216800000,"segment":0,"confidence":null,"asi":{"hypothesis":"Inline string key fast path in parse_object","result":"Metric 161.39 vs 154.21. Regression.","key_insight":"The increased code size and complexity in parse_object might have hurt LuaJIT performance more than the saved function call helped."}}
{"run":31,"commit":"fd4cb40","metric":156.97,"metrics":{"encode_ms":84.49,"decode_ms":72.48,"lua52_total_ms":1132.12,"lua53_total_ms":1090.21,"lua54_total_ms":924.95},"status":"discard","description":"Add tight inner loop for ASCII characters in parse_string slow path — regression","timestamp":1776217400000,"segment":0,"confidence":null,"asi":{"hypothesis":"Inner tight loop for ASCII characters in parse_string slow path","result":"Metric 156.97 vs 154.21. Regression.","key_insight":"The extra inner loop and branching hurt LuaJIT performance more than it helped."}}
